{"$defs":{"adr_id":{"pattern":"^ADR-[0-9]{4}$","type":"string"},"non_blank":{"minLength":1,"pattern":"^(?!\\s)(?!.*\\s$)[^\\u0000-\\u001F\\u007F-\\u009F]+$","type":"string"},"profile_id":{"pattern":"^[a-z][a-z0-9]*(?:-[a-z][a-z0-9]*)*$","type":"string"},"rule_id":{"pattern":"^(?:[A-Z0-9]+-){2,}[0-9]{3}$","type":"string"},"semantic_version":{"pattern":"^(?:0|[1-9][0-9]*)\\.(?:0|[1-9][0-9]*)\\.(?:0|[1-9][0-9]*)(?:-(?:0|[1-9][0-9]*|[0-9]*[A-Za-z-][0-9A-Za-z-]*)(?:\\.(?:0|[1-9][0-9]*|[0-9]*[A-Za-z-][0-9A-Za-z-]*))*)?(?:\\+[0-9A-Za-z-]+(?:\\.[0-9A-Za-z-]+)*)?$","type":"string"}},"$id":"urn:ifl:standards:schema:rule:v1","$schema":"https://json-schema.org/draft/2020-12/schema","additionalProperties":false,"allOf":[{"if":{"properties":{"lifecycle":{"const":"deprecated"}},"required":["lifecycle"]},"then":{"required":["replacement_id"]}},{"if":{"properties":{"lifecycle":{"enum":["proposed","accepted","active"]}},"required":["lifecycle"]},"then":{"not":{"required":["replacement_id"]}}},{"if":{"properties":{"examples_required":{"const":true}},"required":["examples_required"]},"then":{"properties":{"compliant_example_ids":{"minItems":1},"non_compliant_example_ids":{"minItems":1}}}}],"properties":{"compliant_example_ids":{"items":{"$ref":"#/$defs/non_blank"},"type":"array","uniqueItems":true},"effective_in":{"$ref":"#/$defs/semantic_version"},"enforcement":{"enum":["script","independent_review","both"],"type":"string"},"evidence":{"items":{"$ref":"#/$defs/non_blank"},"minItems":1,"type":"array","uniqueItems":true},"examples_required":{"type":"boolean"},"exception_policy":{"$ref":"#/$defs/non_blank"},"id":{"$ref":"#/$defs/rule_id"},"introduced_in":{"$ref":"#/$defs/semantic_version"},"level":{"enum":["must","must_not","should","may"],"type":"string"},"lifecycle":{"enum":["proposed","accepted","active","deprecated","retired"],"type":"string"},"non_compliant_example_ids":{"items":{"$ref":"#/$defs/non_blank"},"type":"array","uniqueItems":true},"profile_ids":{"items":{"$ref":"#/$defs/profile_id"},"minItems":1,"type":"array","uniqueItems":true},"rationale_adrs":{"items":{"$ref":"#/$defs/adr_id"},"minItems":1,"type":"array","uniqueItems":true},"replacement_id":{"$ref":"#/$defs/rule_id"},"risk_class":{"enum":["low","medium","high","critical"],"type":"string"},"schema_version":{"const":1},"scope":{"items":{"$ref":"#/$defs/non_blank"},"minItems":1,"type":"array","uniqueItems":true},"severity":{"enum":["critical","high","medium","low"],"type":"string"},"statement":{"$ref":"#/$defs/non_blank"}},"required":["schema_version","id","level","statement","scope","profile_ids","severity","risk_class","rationale_adrs","evidence","enforcement","exception_policy","lifecycle","introduced_in","effective_in","examples_required","compliant_example_ids","non_compliant_example_ids"],"title":"IFL Canon Rule Record v1","type":"object"}
