{"compliant_example_ids":[],"effective_in":"1.0.0-rc.1","enforcement":"independent_review","evidence":["standards/enterprise/observability-operability.md and the final joined AI consistency review"],"examples_required":false,"exception_policy":"Additional crash context requires Security, Privacy, and Data approval for exact classified fields, retention, owner, and expiry; secrets and authentication material are never permitted.","id":"OBS-CRASH-001","introduced_in":"1.0.0-rc.1","level":"must","lifecycle":"proposed","non_compliant_example_ids":[],"profile_ids":["core"],"rationale_adrs":["ADR-0001"],"risk_class":"critical","schema_version":1,"scope":["crash reports","crash breadcrumbs"],"severity":"critical","statement":"Crash reports and breadcrumbs MUST contain only bounded, classified, minimized, and redacted diagnostic context."}
