{"compliant_example_ids":[],"effective_in":"1.0.0-rc.1","enforcement":"independent_review","evidence":["standards/enterprise/accessibility-global-readiness.md and the final joined AI consistency review"],"examples_required":false,"exception_policy":"A contrast exception requires Accessibility Owner approval, exact visual state, equivalent non-color cue, owner, expiry, and remediation plan.","id":"A11Y-CONTRAST-001","introduced_in":"1.0.0-rc.1","level":"must","lifecycle":"proposed","non_compliant_example_ids":[],"profile_ids":["core"],"rationale_adrs":["ADR-0005"],"risk_class":"high","schema_version":1,"scope":["text contrast","control contrast","state communication","light and dark appearance"],"severity":"high","statement":"Text, controls, focus indicators, and meaningful graphics meet the organization's current approved WCAG AA contrast targets in every supported state, and color is never the sole carrier of meaning."}
