{"compliant_example_ids":[],"effective_in":"1.0.0-rc.1","enforcement":"independent_review","evidence":["standards/enterprise/modern-testing.md, ADR-0011, and the final joined AI consistency review"],"examples_required":false,"exception_policy":"Unavailable executable-code evidence requires the exact command or capability, failure reason, risk, owner, alternate evidence, expiry, and restoration plan; generated or self-reported green text is never accepted.","id":"TEST-EVIDENCE-001","introduced_in":"1.0.0-rc.1","level":"must","lifecycle":"active","non_compliant_example_ids":[],"profile_ids":["core"],"rationale_adrs":["ADR-0011"],"risk_class":"critical","schema_version":1,"scope":["test evidence","build evidence","performance evidence"],"severity":"critical","statement":"Claims about executable-code builds, tests, or performance MUST cite observed command-backed results and relevant context; documentation consistency uses the plan's final AI review instead of fabricated runtime evidence."}
