{"compliant_example_ids":[],"effective_in":"1.0.0-rc.1","enforcement":"independent_review","evidence":["standards/enterprise/supply-chain-legal.md and the final joined AI consistency review"],"examples_required":false,"exception_policy":"A notice gap requires the exact dependency/version and obligation, affected release, Legal/Release owner, approved policy decision, expiry, and correction plan.","id":"LEGAL-NOTICE-001","introduced_in":"1.0.0-rc.1","level":"must","lifecycle":"active","non_compliant_example_ids":[],"profile_ids":["core"],"rationale_adrs":["ADR-0001"],"risk_class":"high","schema_version":1,"scope":["third-party notices","license attribution","release inventory"],"severity":"high","statement":"Required third-party notices and attributions MUST be derived and reviewed against the current release inventory under a named Legal or Release owner."}
