{"compliant_example_ids":[],"effective_in":"1.0.0-rc.1","enforcement":"independent_review","evidence":["standards/enterprise/mobile-security.md and the final joined AI consistency review"],"examples_required":false,"exception_policy":"A delayed threat-model update requires Security Owner approval, an interim risk assessment, an owner, an expiry, and a removal plan.","id":"MSEC-THREAT-001","introduced_in":"1.0.0-rc.1","level":"must","lifecycle":"active","non_compliant_example_ids":[],"profile_ids":["core"],"rationale_adrs":["ADR-0002"],"risk_class":"critical","schema_version":1,"scope":["security-relevant features","assets","trust boundaries","material architecture changes"],"severity":"critical","statement":"Every security-relevant feature and material boundary change maintains an owned threat model identifying protected assets, DATA-CLASS-001 classes, entry points, trust boundaries, abuse cases, mitigations, residual risk, and review event."}
