{"compliant_example_ids":[],"effective_in":"1.0.0-rc.1","enforcement":"independent_review","evidence":["standards/enterprise/swiftui-production.md and the final joined AI consistency review"],"examples_required":false,"exception_policy":"View-local state is allowed only for transient UX or geometry mechanics that do not create product meaning and require no business-layer test.","id":"SWUI-VIEW-001","introduced_in":"1.0.0-rc.1","level":"must_not","lifecycle":"proposed","non_compliant_example_ids":[],"profile_ids":["swiftui"],"rationale_adrs":["ADR-0005","ADR-0009"],"risk_class":"high","schema_version":1,"scope":["SwiftUI View","SwiftUI local state","presentation derivation"],"severity":"high","statement":"A SwiftUI View MUST NOT own business state or dependencies, format raw or domain values, or derive eligibility, status, error, analytics, CTA, or other product-facing meaning."}
