{"compliant_example_ids":[],"effective_in":"1.0.0-rc.1","enforcement":"independent_review","evidence":["standards/specs/COMMUNICATION.md and the final joined AI consistency review"],"examples_required":false,"exception_policy":"A new transport shape requires owner-defined typed contracts and iOS Profile Owner approval; controller reach-through is never an exception.","id":"BRD-COMM-001","introduced_in":"1.0.0-rc.1","level":"must","lifecycle":"active","non_compliant_example_ids":[],"profile_ids":["boardy-vip"],"rationale_adrs":["ADR-0006"],"risk_class":"high","schema_version":1,"scope":["cross-board communication","Board-to-controller communication"],"severity":"high","statement":"Boards communicate through owner-defined typed IO, flows, and event buses and must not retrieve another Board's controller as a communication channel."}
