{"compliant_example_ids":[],"effective_in":"1.0.0-rc.1","enforcement":"independent_review","evidence":["standards/enterprise/mobile-security.md and the final joined AI consistency review"],"examples_required":false,"exception_policy":"A less restrictive accessibility or access-control policy requires Security Owner approval tied to the exact data class, operational need, owner, expiry, and mitigation.","id":"MSEC-KEYCHAIN-001","introduced_in":"1.0.0-rc.1","level":"must","lifecycle":"active","non_compliant_example_ids":[],"profile_ids":["core"],"rationale_adrs":["ADR-0002"],"risk_class":"critical","schema_version":1,"scope":["Keychain credential storage","Keychain accessibility","Keychain access control"],"severity":"critical","statement":"Credentials and small security-sensitive values use Keychain with the least-permissive accessibility, access control, and synchronization behavior compatible with their DATA-CLASS-001 class and documented runtime needs."}
