{"compliant_example_ids":[],"effective_in":"1.0.0-rc.1","enforcement":"independent_review","evidence":["standards/enterprise/mobile-security.md and the final joined AI consistency review"],"examples_required":false,"exception_policy":"Pinning or another trust-policy deviation requires human Security authority, threat-model rationale, backup and rotation plan, outage recovery, owner, expiry, and removal decision.","id":"MSEC-NET-001","introduced_in":"1.0.0-rc.1","level":"must","lifecycle":"active","non_compliant_example_ids":[],"profile_ids":["core"],"rationale_adrs":["ADR-0002"],"risk_class":"critical","schema_version":1,"scope":["TLS trust evaluation","URLSession challenges","certificate pinning"],"severity":"critical","statement":"Network clients use platform hostname and certificate trust evaluation, never trust-all behavior; any approved pinning adds explicit backup, rotation, expiry, outage-recovery, and removal controls."}
