{"compliant_example_ids":[],"effective_in":"1.0.0-rc.1","enforcement":"independent_review","evidence":["standards/enterprise/modern-testing.md, ADR-0011, and the final joined AI consistency review"],"examples_required":false,"exception_policy":"A temporarily unavailable critical-flow smoke requires the exact journey, release risk, alternate evidence, owner, expiry, and restoration plan.","id":"TEST-SMOKE-001","introduced_in":"1.0.0-rc.1","level":"must","lifecycle":"proposed","non_compliant_example_ids":[],"profile_ids":["core"],"rationale_adrs":["ADR-0011"],"risk_class":"high","schema_version":1,"scope":["critical UI journeys","release smoke tests"],"severity":"high","statement":"Each release-critical user journey MUST have a small owned UI smoke that uses deterministic preconditions and asserts the user-visible terminal outcome."}
