{"compliant_example_ids":[],"effective_in":"1.0.0-rc.1","enforcement":"independent_review","evidence":["standards/brain/patterns/VIP.md and the final joined AI consistency review"],"examples_required":false,"exception_policy":"Pure nonisolated mapping may occur off-main only before it mutates a UI adapter or presentation store; mutation itself has no exception.","id":"UI-ISOLATION-001","introduced_in":"1.0.0-rc.1","level":"must","lifecycle":"active","non_compliant_example_ids":[],"profile_ids":["boardy-vip","swiftui","uikit"],"rationale_adrs":["ADR-0005","ADR-0009"],"risk_class":"high","schema_version":1,"scope":["UI mutation","presentation-store mutation","asynchronous presentation"],"severity":"high","statement":"Every UI or presentation-store mutation occurs on the declared MainActor boundary, using an explicit hop when asynchronous work originates elsewhere."}
