{"compliant_example_ids":[],"effective_in":"1.0.0-rc.1","enforcement":"independent_review","evidence":["standards/enterprise/data-lifecycle.md and the final joined AI consistency review"],"examples_required":false,"exception_policy":"A temporary cache-bound exception identifies exact class, cache, measured capacity or age, owner, expiry, compensating purge trigger, and removal plan.","id":"DATA-CACHE-001","introduced_in":"1.0.0-rc.1","level":"must","lifecycle":"active","non_compliant_example_ids":[],"profile_ids":["core"],"rationale_adrs":["ADR-0001","ADR-0002"],"risk_class":"high","schema_version":1,"scope":["memory caches","disk caches","derived indexes","download caches"],"severity":"high","statement":"A cache MUST inherit the highest classification of its source data and declare a capacity or record bound, maximum age, eviction policy, and purge triggers for logout, account removal, purpose withdrawal, and classification change where applicable."}
