{"compliant_example_ids":[],"effective_in":"1.0.0-rc.1","enforcement":"independent_review","evidence":["standards/specs/MICROBOARD_UI.md and the final joined AI consistency review"],"examples_required":false,"exception_policy":"No business dependency may be constructed by a ViewController; composition belongs to a Builder or declared composition root.","id":"UIKIT-DI-001","introduced_in":"1.0.0-rc.1","level":"must_not","lifecycle":"active","non_compliant_example_ids":[],"profile_ids":["uikit"],"rationale_adrs":["ADR-0008"],"risk_class":"high","schema_version":1,"scope":["UIViewController","business dependency construction"],"severity":"high","statement":"A UIKit ViewController must not construct repositories, use cases, services, or other business dependencies; its Builder or a declared composition root supplies them."}
