{"compliant_example_ids":[],"effective_in":"1.0.0-rc.1","enforcement":"independent_review","evidence":["standards/enterprise/swift-6-concurrency.md and the final joined AI consistency review"],"examples_required":false,"exception_policy":"An unstructured or detached task requires an explicit owner, bounded lifetime, failure policy, cancellation policy, and justification for unavailable structured ownership.","id":"CONC-TASK-001","introduced_in":"1.0.0-rc.1","level":"must","lifecycle":"proposed","non_compliant_example_ids":[],"profile_ids":["core"],"rationale_adrs":["ADR-0010"],"risk_class":"high","schema_version":1,"scope":["asynchronous task creation","task groups","feature lifetimes"],"severity":"high","statement":"Asynchronous work MUST use structured concurrency by default; every unstructured or detached task MUST have a named owner, bounded lifetime, completion policy, and cancellation path."}
