{"compliant_example_ids":[],"effective_in":"1.0.0-rc.1","enforcement":"independent_review","evidence":["standards/enterprise/data-lifecycle.md and the final joined AI consistency review"],"examples_required":false,"exception_policy":"A classification dispute uses the higher class until the Data Lifecycle Owner resolves it; feature-local taxonomies are not permitted.","id":"DATA-CLASS-001","introduced_in":"1.0.0-rc.1","level":"must","lifecycle":"proposed","non_compliant_example_ids":[],"profile_ids":["core"],"rationale_adrs":["ADR-0001"],"risk_class":"critical","schema_version":1,"scope":["product data inventory","data contracts","downstream security privacy and observability standards"],"severity":"critical","statement":"Every product-data element MUST be classified before storage or processing as public, internal, confidential, or restricted using the canonical taxonomy in the Data Lifecycle chapter; downstream standards MUST NOT define a competing taxonomy."}
