{"compliant_example_ids":[],"effective_in":"1.0.0-rc.1","enforcement":"independent_review","evidence":["standards/enterprise/modern-testing.md, ADR-0011, and the final joined AI consistency review"],"examples_required":false,"exception_policy":"A temporarily uncontrolled asynchronous dependency requires a bounded await, owner, flake-risk assessment, isolation plan, expiry, and deterministic replacement plan; arbitrary timing sleeps remain prohibited as proof.","id":"TEST-ASYNC-001","introduced_in":"1.0.0-rc.1","level":"must","lifecycle":"active","non_compliant_example_ids":[],"profile_ids":["core"],"rationale_adrs":["ADR-0011"],"risk_class":"high","schema_version":1,"scope":["asynchronous tests","clocks","schedulers","AsyncSequence","cancellation"],"severity":"high","statement":"Asynchronous tests MUST control time and event production where applicable, use bounded awaits, propagate cancellation, and prove deterministic completion without timing sleeps."}
