{"compliant_example_ids":[],"effective_in":"1.0.0-rc.1","enforcement":"independent_review","evidence":["standards/enterprise/observability-operability.md and the final joined AI consistency review"],"examples_required":false,"exception_policy":"No exception permits secrets or authentication material; other exact classified fields require Security, Privacy, and Data authority, compensating controls, expiry, and deletion plan.","id":"OBS-REDACT-001","introduced_in":"1.0.0-rc.1","level":"must","lifecycle":"proposed","non_compliant_example_ids":[],"profile_ids":["core"],"rationale_adrs":["ADR-0001"],"risk_class":"critical","schema_version":1,"scope":["telemetry fields","diagnostic persistence","diagnostic transport"],"severity":"critical","statement":"Classification-aware minimization and redaction MUST occur before diagnostic data is persisted, buffered, or transported."}
