{"compliant_example_ids":[],"effective_in":"1.0.0-rc.1","enforcement":"independent_review","evidence":["standards/enterprise/supply-chain-legal.md and the final joined AI consistency review"],"examples_required":false,"exception_policy":"A release-integrity gap requires the exact artifact and missing linkage, affected release, owner, approved organization-policy decision, expiry, compensating custody controls, and provenance-restoration plan.","id":"SUP-INTEGRITY-001","introduced_in":"1.0.0-rc.1","level":"must","lifecycle":"active","non_compliant_example_ids":[],"profile_ids":["core"],"rationale_adrs":["ADR-0001"],"risk_class":"critical","schema_version":1,"scope":["release artifacts","build provenance","source integrity","dependency integrity"],"severity":"critical","statement":"Each distributable release artifact MUST be integrity-bound through the organization's release process to reviewed source revision, resolved dependency inventory, toolchain, and signing context."}
