{"compliant_example_ids":[],"effective_in":"1.0.0-rc.1","enforcement":"independent_review","evidence":["standards/enterprise/swiftui-production.md and the final joined AI consistency review"],"examples_required":false,"exception_policy":"Long-lived work moves to an explicitly owned feature service or store; it may not be hidden in an untracked View task.","id":"SWUI-LIFE-001","introduced_in":"1.0.0-rc.1","level":"must","lifecycle":"active","non_compliant_example_ids":[],"profile_ids":["swiftui"],"rationale_adrs":["ADR-0009","ADR-0010"],"risk_class":"high","schema_version":1,"scope":["SwiftUI task lifecycle","view identity","feature lifetime"],"severity":"high","statement":"SwiftUI asynchronous work MUST be scoped to stable View or feature identity, propagate cancellation when that scope ends or changes, and prevent late results from mutating stale presentation state."}
