{"compliant_example_ids":[],"effective_in":"1.0.0-rc.1","enforcement":"independent_review","evidence":["standards/enterprise/accessibility-global-readiness.md and the final joined AI consistency review"],"examples_required":false,"exception_policy":"A user-facing literal remains outside the localization system only with Localization Owner approval, exact non-localizable rationale, owner, expiry, and migration plan.","id":"I18N-LOCALIZE-001","introduced_in":"1.0.0-rc.1","level":"must","lifecycle":"active","non_compliant_example_ids":[],"profile_ids":["core"],"rationale_adrs":["ADR-0005"],"risk_class":"medium","schema_version":1,"scope":["user-facing copy","String Catalogs","localization keys","translator context"],"severity":"high","statement":"All user-facing copy uses the approved localization system with stable semantic keys, translator context, and named ownership; identifiers, URLs, event names, keys, and configuration remain distinct from copy."}
