{"compliant_example_ids":[],"effective_in":"1.0.0-rc.1","enforcement":"independent_review","evidence":["standards/specs/IO_INTERFACE.md and the final joined AI consistency review"],"examples_required":false,"exception_policy":"Legacy IDs require an explicit migration alias and removal plan approved by the iOS Profile Owner.","id":"BRD-ID-001","introduced_in":"1.0.0-rc.1","level":"must","lifecycle":"proposed","non_compliant_example_ids":[],"profile_ids":["boardy-vip"],"rationale_adrs":["ADR-0004"],"risk_class":"medium","schema_version":1,"scope":["public BoardID declarations"],"severity":"high","statement":"Public BoardID raw values use pub.mod.<Module>.<Board> and must not include an IO suffix in the module segment."}
