{"compliant_example_ids":[],"effective_in":"1.0.0-rc.1","enforcement":"independent_review","evidence":["standards/enterprise/performance-resilience.md and the final joined AI consistency review"],"examples_required":false,"exception_policy":"A memory-budget exception records the exact scenario, peak/steady measurement, affected devices, bounded compensating control, owner, expiry, and remediation plan; unbounded growth is never permitted.","id":"PERF-MEM-001","introduced_in":"1.0.0-rc.1","level":"must","lifecycle":"proposed","non_compliant_example_ids":[],"profile_ids":["core"],"rationale_adrs":["ADR-0011"],"risk_class":"critical","schema_version":1,"scope":["memory budgets","caches","per-activation resources"],"severity":"critical","statement":"Memory-intensive journeys MUST declare representative peak and steady-state budgets, bound caches and collections, and release scoped resources deterministically."}
