{"compliant_example_ids":[],"effective_in":"1.0.0-rc.1","enforcement":"independent_review","evidence":["standards/enterprise/privacy-compliance.md and the final joined AI consistency review"],"examples_required":false,"exception_policy":"No Agent or unnamed group may own or approve disclosure text; interim disclosure changes require designated human Privacy or Legal authority, exact scope, owner, expiry, and finalization plan.","id":"PRIV-DISCLOSE-001","introduced_in":"1.0.0-rc.1","level":"must","lifecycle":"proposed","non_compliant_example_ids":[],"profile_ids":["core"],"rationale_adrs":["ADR-0001"],"risk_class":"critical","schema_version":1,"scope":["privacy notices","external disclosures","SDK and partner data sharing","change control"],"severity":"critical","statement":"Every external disclosure and privacy statement has a named human owner accountable for its data, purpose, recipient, sharing role, retention description, accuracy, approval, and change control."}
