{"compliant_example_ids":[],"effective_in":"1.0.0-rc.1","enforcement":"independent_review","evidence":["standards/enterprise/swift-6-concurrency.md and the final joined AI consistency review"],"examples_required":false,"exception_policy":"A non-cancellable external operation must still stop downstream work, release local resources, and document reconciliation of a late result.","id":"CONC-CANCEL-001","introduced_in":"1.0.0-rc.1","level":"must","lifecycle":"proposed","non_compliant_example_ids":[],"profile_ids":["core"],"rationale_adrs":["ADR-0010"],"risk_class":"high","schema_version":1,"scope":["async use cases","service adapters","UI-scoped tasks"],"severity":"high","statement":"Cancellation MUST propagate through owned asynchronous work, be observed at meaningful boundaries, perform required cleanup, and prevent a cancelled result from mutating stale state."}
